Phrase	Cognitive Distortion
It does not seem fair to me that the company does not promote internally. I believe I am a better fit for the manager position because I have been here for years and am therefore familiar with the company, and I have already demonstrated that I have a high capacity to develop my job.	Fallacy Of Fairness
Life should be fair and equal, and I should receive what I deserve.	Fallacy Of Fairness
You expect your partner coming home to massage your feet. It's only "fair" because you spent the entire afternoon preparing their dinner. They arrive, however, exhausted and only want to take a bath.	Fallacy Of Fairness
I expect my husband to pay attention to me and pay for all of my things because I cook all of the meals, keep the house clean, and care for the dogs, but he works all day and then eats and goes to bed. This is so unfair, and I feel isolated and mistreated.	Fallacy Of Fairness
I am aware that my husband works very hard and is exhausted when he gets home from work, but I also have a full-time job. It's terribly unfair that I got to handle all the cleaning by myself, therefore I don't understand why he can't just do his responsibilities.	Fallacy Of Fairness
I recently received a ticket for stopping the car for only five minutes to go to the shop before it closed. It's incredibly unfair that the police officer didn't immediately comprehend my situation since I was obviously hurried.	Fallacy Of Fairness
When I arrive home from work, I expect my wife and kids to welcome me with a lot of love because I work my heart off to support my family in any way I can, but they just don't care and they always ignore me and treat me unfairly.	Fallacy Of Fairness
It is unfair that the teacher penalized me for being late when he had no consideration for my adhd condition. He is indifferent about my difficulties.	Fallacy Of Fairness
Teachers, in my opinion, should give special consideration to students who suffer from anxiety. Obliging them to give presentations is tantamount to torturing them.	Fallacy Of Fairness
A nonsmoker gets cancer, whereas heavy smokers never get cancer.	Fallacy Of Fairness
Unprepared teenagers who do not want children become pregnant more easily than responsible adults who do want children.	Fallacy Of Fairness
It's unfair that they let any fan win simply because they pay more money when there are die-hard fans like me who support the band but never win a meet and greet.	Fallacy Of Fairness
I've been waiting in the TSA security line at the airport for 20 minutes when suddenly another line opens up right next to you. People who have recently approached the line are now entering security ahead of you. This is utterly unfair.	Fallacy Of Fairness
People who are losing in life must have done something to earn it.	Fallacy Of Fairness
Jennifer is now the captain, which is unfair.	Fallacy Of Fairness
I volunteer to assist a friend with an errand, but she is unavailable when I need to run one.	Fallacy Of Fairness
My boss would give me a raise if he valued me.	Fallacy Of Fairness
You don’t know what you’re talking about. I know that technique won’t help me.	Always Being Right
I don’t care how badly arguing with me makes you feel, I’m going to win this argument no matter what because I’m right.	Always Being Right
I’m right and you’re wrong Sandra just admit it!	Always Being Right
You argue with your sibling about how your parents have not been supportive enough. You're convinced this was always the case, whereas your sibling believes it changed depending on the situation. Because your sibling does not share your feelings, you become enraged and say things that irritate your sibling. You can tell they're getting frustrated, but you keep arguing to prove your point.	Always Being Right
It's more than just a difference of opinion; it's an intellectual battle that must be won at all costs.	Always Being Right
Two coworkers disagree on how one technical aspect of the project should be carried out. One person believes it should be done their way because it has always been done that way. The other, on the other hand, claims that there are industry-standard procedures that must be followed. The individual completely disregards these facts and argues their point to any extent.	Always Being Right
Who are you to tell me how I should educate my children?	Always Being Right
I'm not going to take this medicine, no matter what the doctor says, because I read on the internet that it's dangerous.	Always Being Right
I'd rather lose a friend than admit I'm wrong.	Always Being Right
You have no idea what you're talking about. That technique will not help me.	Always Being Right
You don't know what you're talking about. That technique won't help me.	Always Being Right
You and your sibling are arguing about how your parents have not been supportive enough. You believe this has always been the case, whereas your sibling believes it varies depending on the circumstances. You become enraged and say things that irritate your sibling because your sibling does not share your feelings. You can tell they're frustrated, but you continue to argue to prove your point.	Always Being Right
You and your sibling argue about how your parents are not supportive enough. You believe that this is always the case, whereas your sibling believes that it varies depending on the circumstances. You get angry and say things that upset your sibling because your sibling doesn't share the same feelings as you. You can tell that they are frustrated, but you keep arguing to prove your point.	Always Being Right
This is more than just a difference of opinion; it is an intellectual battle that must be won at all costs.	Always Being Right
Two coworkers disagree on how to carry out one technical aspect of the project. One person believes it should be done their way because that is how it has always been done. The other, on the other hand, contends that industry-standard procedures must be followed. The individual completely ignores these facts and argues their point to the best of their ability.	Always Being Right
Two coworkers disagree on how to execute one technical aspect of the project. One person believes that it should be done their way because that is how it has always been done. The other, on the other hand, is of the opinion that industry standard procedures should be followed. The individuals completely ignore these facts and put forward their opinions to the best of their abilities.	Always Being Right
Who are you to tell me how to raise my children?	Always Being Right
Regardless of what the doctor says, I'm not going to take this medicine because I read on the internet that it's dangerous.	Always Being Right
Regardless of what the doctor said, I would not take this medication because I read on the internet that it was dangerous.	Always Being Right
I'd rather lose a friend than admit I was mistaken.	Always Being Right
No one is going to listen to me because of my stuttering.	Control Fallacies
The bad economy means there is no point in trying to find a job.	Control Fallacies
I’m too old to try dating, nobody will want me.	Control Fallacies
There’s no point in trying.	Control Fallacies
The men who robbed me made me feel I can’t leave the house.	Control Fallacies
I can’t control ANY of this! I feel so stuck!	Control Fallacies
What hope do I have to change.	Control Fallacies
This is all my fault! I should have done something more!	Control Fallacies
I can’t help that I was late, I slept through my alarm	Control Fallacies
Why are you unhappy? Is it something I did?	Control Fallacies
I'm sorry if my stuttering bothers you.	Control Fallacies
Of course, I couldn't finish it! My boss is overworking me, and the office was extremely noisy today. Who can accomplish anything like that?	Control Fallacies
My sister's mood is dependent on me; I must pay attention to her so that she does not feel isolated.	Control Fallacies
I have no control over ANY of this! I'm so stuck!	Control Fallacies
It's all my fault! I really should have done more!	Control Fallacies
I feel like a failure because I can't even cheer up my depressed husband's spirits.	Control Fallacies
I blame my boss for my poor performance; how can I work well under such extreme stress?	Control Fallacies
Everything is up to me; I am in charge of everything that happens to me.	Control Fallacies
I have no control over anything in my surroundings.	Control Fallacies
My partner left me because I cheated and lied to her. I had no say in what happened.	Control Fallacies
A coworker made a technical error on a work task. This error had serious consequences for other tasks. I feel guilty and responsible because I overlooked the error when reviewing their work.	Control Fallacies
I get a flat tire and believe that the universe is conspiring against me.	Control Fallacies
I exhaust myself by attempting to please and/or fix others, only to make myself miserable.	Control Fallacies
Nobody understands that I have a severe drug addiction and that I have no control over my unfortunate situation. My life will never be the same again, no matter how hard I try.	Control Fallacies
I lost a lot of money in the stock market in one day and I'm blaming myself.	Control Fallacies
I should not have left my house alone when I was a child; my mother would still be here. Because of me, she was hit by a car.	Control Fallacies
I'm not to blame for not arriving on time; the train was moving at an excruciatingly slow pace.	Control Fallacies
Stop making me feel sorry for myself!	Control Fallacies
No one would listen to me because of my stuttering.	Control Fallacies
A bad economy means there is no point in trying to find a job.	Control Fallacies
The people who robbed me made me feel like I couldn't leave the house.	Control Fallacies
Everything is up to me; I am responsible for everything that happens to me.	Control Fallacies
I apologize if my stuttering bothered you.	Control Fallacies
It's all my fault! I should have done more things!	Control Fallacies
I felt like a failure because I couldn't even lift my depressed husband's spirits.	Control Fallacies
I can't control ANY of this! I feel so trapped!	Control Fallacies
My partner left me because I cheated and lied to her. I had no part in what happened.	Control Fallacies
My sister's mood depends on me; I have to pay attention to her so that she doesn't feel isolated.	Control Fallacies
What expectations do I have to change.	Control Fallacies
Everything is up to me; I am responsible for everything that happens to me.	Control Fallacies
I got a flat tire and believed that the universe was conspiring against me.	Control Fallacies
Anna blamed herself for her daughter's bad grade in school. Instead of trying to find out why her daughter is struggling and exploring ways to help, Anna assumes it is a sign that she is a bad mother.	Personalization
If he had been ready to leave on time, I wouldn’t have eaten that extra donut and my stomach wouldn’t be hurting.	Personalization
I just had to write him up for insubordination. I didn’t train him well enough.	Personalization
My coworker is upset about not getting the project. I wouldn’t have tried so hard to get it myself if I had known he wanted it so bad.	Personalization
I totally ruined our company’s chances of getting the contract during our team presentation.	Personalization
My lab partner overslept and missed class so now we have both failed our team assignment. It is completely my fault because I didn’t call to make sure she was up.	Personalization
My partner has a health condition but isn't following his doctor's treatment recommendations, and I feel guilty for not doing enough to help when his health deteriorates.	Personalization
When I walk into the break room at work, everyone stops talking, and I begin to suspect that everyone is gossiping about me behind my back.	Personalization
This is entirely my fault. They wouldn't have been hurt if I hadn't let little Jimmy go to school today. I can't deal with this; I need to screw up.	Personalization
My neighbor mentioned that they don't let their children play outside after dark. This strikes me as a direct attack on the way I raise my children.	Personalization
Anna blamed herself for her daughter's poor grades at school. Instead of trying to figure out why her daughter was struggling and finding ways to help, Anna took it as a sign that she was a bad mom.	Personalization
Had he been ready to leave on time, I wouldn't have eaten that extra doughnut and my stomach wouldn't have hurt.	Personalization
My coworker was upset about not getting the project. I wouldn't have tried so hard to get it myself if I knew she wanted it so badly.	Personalization
My lab partner overslept and missed class, so now we both failed our team assignment. This is entirely my fault because I didn't call to make sure he was awake.	Personalization
My partner had a health condition but didn't follow his doctor's treatment recommendations, and I felt guilty for not doing enough to help when his health deteriorated.	Personalization
When I walked into the break room at work, everyone stopped talking, and I began to suspect that everyone was gossiping about me behind my back.	Personalization
This is entirely my fault. They wouldn't have gotten hurt if I hadn't let little Jimmy go to school today. I can't face this; I have to screw it up.	Personalization
This is my fault; if I had looked after my sister, she would have gone missing.	Personalization
People must be mocking me because of my humiliating fall.	Personalization
I feel bad because my sister doesn't take care of herself, and I feel guilty because I don't think I'm doing enough to make her realize she needs to be more aware of her health problems.	Personalization
My father missed his flight because he did not renew his passport. This is entirely my fault because I failed to remind him.	Personalization
I felt bad that my sister wasn't taking care of herself, and I felt guilty because I don't think I did enough to make her realize that she needed to be more aware of her health issues.	Personalization
People must have mocked me for my embarrassing fall.	Personalization
She wouldn't be dead if she hadn't been so annoying while I was driving.	Personalization
If she stopped being so annoying while I was driving she wouldn't be dead now.	Personalization
My friend said she wouldn't talk behind people's backs, so she must be referring to me.	Personalization
I'm sorry because my mother missed her deadline because I didn't assist her.	Personalization
Why do I always hit every red light?	Overgeneralization
Why does everyone walk so slowly?	Overgeneralization
if a person once sees a dog being loud and aggressive, they might assume that all dogs are equally as dangerous and decides to avoid them all.	Overgeneralization
If you go on one date with a man and he turns out to be an awful and rude person, you might overgeneralize and conclude that all men are just as terrible.	Overgeneralization
It’s important to never let anyone down.	Overgeneralization
Nothing good ever happens to me	Overgeneralization
Other people should never let me down.	Overgeneralization
Everything is always terrible.	Overgeneralization
I'm always going to be stuck at home	Overgeneralization
I'm never going to get to see my family again	Overgeneralization
I'm always going to be alone and isolated	Overgeneralization
Things will never be like they were before.	Overgeneralization
I'm never going to be able to travel again.	Overgeneralization
The pandemic will last forever.	Overgeneralization
After attending a job interview and being told I didn't get the job, I conclude I'll never get a job and am depressed about my future.	Overgeneralization
I'm disgusted that my friend believes in a completely different ideology.	Overgeneralization
After spending five minutes learning to shoot a free throw and failing to make any baskets, I conclude basketball is too difficult and give up, believing it will always be this difficult.	Overgeneralization
After the first date, they stop responding to our texts, leading me to believe that I will never be asked on a second date. Furthermore, I believe I will never find love!	Overgeneralization
I had a really low math grade, so I must be hopeless at math in general.	Overgeneralization
I simply believe that I am not good at relationships because I have always had negative experiences.	Overgeneralization
When my husband arrived home this evening, he did not kiss me. Perhaps he no longer loves me.	Overgeneralization
I'm never good in social situations.	Overgeneralization
You never pay attention.	Overgeneralization
You should never put your trust in someone like this.	Overgeneralization
Nothing ever goes right for me.	Overgeneralization
Everything is always bad.	Overgeneralization
I didn't tell her everything that happened the day before. I tell lies. I can't be trusted.	Overgeneralization
I lied for the first time today, so I'm no longer a trustworthy individual.	Overgeneralization
I completely missed that turn. I'm an awful driver.	Overgeneralization
I ran through two red lights in a row. I always run through every red light!	Overgeneralization
Yesterday, a man was robbed. This city is extremely dangerous.	Overgeneralization
Because I grew up in a bad environment where showing love was rare, I believe that love does not exist.	Overgeneralization
It's just my luck! Birds are constantly pooping on my car!	Overgeneralization
I'm afraid to meet the university group because they, like my classmates, can make fun of my physique.	Overgeneralization
Why is everyone walking so slowly?	Overgeneralization
if someone has seen a noisy and aggressive dog, they may assume that all dogs are equally dangerous and decide to avoid them all.	Overgeneralization
If you go on a date with a guy and find out that he is a bad and rude person, you might overgeneralize and conclude that all guys are equally bad.	Overgeneralization
Other people can't let me down.	Overgeneralization
I will always be stuck at home	Overgeneralization
I will never be able to travel again.	Overgeneralization
A friend does not return your phone call and you assume, He’s intentionally avoiding me	Jumping to Conclusions
I’ll never meet someone to settle down with	Jumping to Conclusions
They all already think I’m dumb. I just know I will make a mistake and ruin this entire project.	Jumping to Conclusions
Aidan has a panic attack at work in front of several coworkers. He assumes that his co-workers think negatively about him because of his anxiety. He believes that he will lose his job if his employer finds out about his condition.	Jumping to Conclusions
James wants to ask someone out on a date but assumes that they will say no. Because of this, he never asks.	Jumping to Conclusions
Remy feels like they are going to fail their math test no matter what they do to prepare. Because they believe that failure is inevitable, they don't study and don't give their full effort during the exam.	Jumping to Conclusions
He's deliberately avoiding me.	Jumping to Conclusions
I'll never find anyone to settle down with.	Jumping to Conclusions
Mike believes Rita has lost interest in him because she does not respond immediately.	Jumping to Conclusions
Jenna observes that her boss did not smile when she greeted him. She's convinced she must have irritated him in some way. She keeps searching her mind for what she did wrong.	Jumping to Conclusions
Because of her irresponsibility, Martha believes she will never be a good mother.	Jumping to Conclusions
Bill thinks blondes are stupid and not worth hiring while interviewing one for a job.	Jumping to Conclusions
Tom texted a friend to say hello, but he did not receive a response. Tom deduced that his friend is upset with him.	Jumping to Conclusions
Abby decided not to pursue a promotion at work, despite her supervisor's encouragement, because she believed that other candidates would be more qualified.	Jumping to Conclusions
Sarah broke up with her boyfriend because she was afraid he was about to break up with her, despite his assurances to the contrary.	Jumping to Conclusions
Nothing ever changes.	Jumping to Conclusions
I'm terrified of flying, and I'm afraid this plane will crash any minute.	Jumping to Conclusions
Because I have a cat phobia, I screamed when I saw a cat, and I was thinking to myself that cats are extremely violent and dangerous.	Jumping to Conclusions
Other people are judging me because they can see how nervous I am.	Jumping to Conclusions
Nobody loves me.	Jumping to Conclusions
Nobodoy cares about me.	Jumping to Conclusions
Nothing can help because I'm irreparably damaged.	Jumping to Conclusions
It's pointless to try psychotherapy homework because it can't possibly help.	Jumping to Conclusions
Because the restaurant appears to be in disrepair, the food must be as well.	Jumping to Conclusions
Because he drives a Ferrari, he must be extremely wealthy.	Jumping to Conclusions
I believe I will fail the exam because I am having difficulty with some of the questions.	Jumping to Conclusions
I assumed that someone disliked me because they didn't seem enthusiastic when I said "good morning."	Jumping to Conclusions
noticing smoke coming from a house window and immediately assuming the house is on fire	Jumping to Conclusions
Assuming that because I didn't get along with one member of a certain social group, I won't get along with anyone else in that group.	Jumping to Conclusions
When a friend does not return your phone call, you assume he is avoiding you on purpose.	Jumping to Conclusions
When a friend doesn't return your calls, you assume they are intentionally avoiding you.	Jumping to Conclusions
I will never find someone to settle down with.	Jumping to Conclusions
They all already thought I was stupid. I just know I'm going to make a mistake and ruin this whole project.	Jumping to Conclusions
Aidan had a panic attack at work in front of some of his coworkers. He assumed that his coworkers were thinking negatively about him because of his anxiety. He believed that he would lose his job if his boss found out about his condition.	Jumping to Conclusions
James wanted to ask someone out but assumed that they would say no. Therefore, he never asked.	Jumping to Conclusions
Remy felt that they would fail their math exam, no matter what they did to prepare. Because they believed that failure was inevitable, they did not study and did not give their full effort during the exam.	Jumping to Conclusions
He deliberately avoided me.	Jumping to Conclusions
Mike believed Rita had lost interest in him because she didn't respond immediately.	Jumping to Conclusions
Jenna observed that her boss did not smile when she greeted him. She was convinced that she must have upset him. She kept looking around for what she had done wrong.	Jumping to Conclusions
Being irresponsible, Martha believed that she would never be a good mother.	Jumping to Conclusions
Bill thinks that blondes are stupid and unemployable when interviewing someone for a job.	Jumping to Conclusions
Tom sent a text message to a friend to say hello, but he received no response. Tom concluded that his friend was upset with him.	Jumping to Conclusions
Abby decided not to pursue a promotion at work, despite encouragement from her supervisor, as she believed that other candidates would be more qualified.	Jumping to Conclusions
Sarah broke up with her boyfriend because she was afraid he would break up with her, even though he assured her otherwise.	Jumping to Conclusions
I'm afraid to fly, and I'm afraid this plane will crash any minute.	Jumping to Conclusions
Because I have a phobia of cats, I scream when I see a cat, and I think that cats are very vicious and dangerous.	Jumping to Conclusions
assuming that someone dislikes a particular hobby because people of their gender do not usually participate in it	Jumping to Conclusions
If I feel it it must be true	Emotional Reasoning
I feel guilty, so I must have done something bad	Emotional Reasoning
I’m feeling inadequate, so I must be worthless	Emotional Reasoning
I feel afraid, so I must be in a dangerous situation.	Emotional Reasoning
While driving home from work in rush hour traffic, Monica had a close call on the freeway. She felt nervous and her heart raced. Monica now no longer wants to drive on the freeway, believing that she will be at risk for getting into an accident.	Emotional Reasoning
Leon has never felt safe in planes. On his last business trip, he started to fear his upcoming flight several days in advance. Leon would look up information on the internet that would confirm his fear of flying, such as information on past issues with flights. On the day of his trip, Leon began shaking and sweating as he boarded the plane. At one point, the pilot warned that there was going to be some turbulence and requested passengers to put on their seatbelts. Leon told himself that “He knew the plane was going to crash.” Leon’s self-talk escalated as he had a panic attack.	Emotional Reasoning
Concluding that because you feel fat you must be fat even though you have a healthy BMI and know this.	Emotional Reasoning
Deciding that because you feel lonely you deduce that no one must love you and that you are unlovable.	Emotional Reasoning
You had a close call on your drive home and felt a spike in your heart rate and blood pressure. Because of this close call, you conclude that your usual route home is no longer safe and refuse to drive it again.	Emotional Reasoning
You feel lonely so you’re compelled to deduce that no one cares about you, that your feeling unequivocally confirms your unlovability.	Emotional Reasoning
You feel enraged with someone, so you take for granted that they must have done something bad, though you really can’t put your finger on anything specific and nothing about their behavior seems to provoke anyone else.	Emotional Reasoning
