Phrase	Cognitive Distortion
A friend or family member who normally responds to me does not respond in the way I expect, so I decide that the relationship has been a waste of time.	Filtering
Fixating on the next day is Monday, and this ruins my Sunday.	Filtering
Everything that could go wrong did.	Filtering
I have the worst luck in the entire world.	Filtering
I just failed that math test. I’m no good at school, and I might as well quit.	Filtering
It’s performance review time at my company, and my manager compliments my hard work several times. In the end, they make one improvement suggestion. I leave the meeting feeling miserable and dwell on that one suggestion all day long.	Filtering
My husband says he wishes I was better at housekeeping, so I must be a lousy wife.	Filtering
I am an expert in my field and was asked to present a one-day workshop at a local college. During my presentation, I noticed that a student walks out and never returns. After class, many students come up to me to thank me for my valuable presentation. However, I drive home feeling angry at the one student who left. I also keep anxiously self-doubting my own work, wondering if the student would have stayed if my lecture had been more interesting.	Filtering
I have long struggled with major depressive disorder and anxiety. Through psychotherapy, I have started to learn how to forgive those who have hurt ne in my past. By forgiving my mother, I had developed a closer relationship with her and had even started to trust her more. One day I opened up to my mother about my diagnosis of depression. My mother responded less compassionately than I had expected. I became infuriated and determined that I never should have forgiven my mother in the first place. Although my mother apologized for the misunderstanding, I refused to talk to her and now I feel that therapy was a waste of time.	Filtering
No one is going to like me	Filtering
I can never do anything right	Filtering
The world is a terrible place and it’s getting worse every day	Filtering
I have a good day at work, but then the restaurant messes up my takeout and my whole day is ruined.	Filtering
I obsess about the one question I got wrong on a test.	Filtering
I can still remember a review at work probably 10 years ago where I got a piece of feedback that I needed to manage my stress levels better. I’m sure my boss had a half dozen nice things to say, but I don’t remember any of them.	Filtering
I fall out of love with my partner beacuse I only notice the bad that they do.	Filtering
If someone compliments the way I look forward, I think they’re just being nice. If my boss tells me how comprehensive my report was, I discount it as something anyone else could do. If I do well in that job interview, I think it’s because they didn’t realize I'm not that good.	Filtering
The only events that matter are failures. I should measure myself by my errors.	Filtering
I had a long block during one of my interview questions. I’ll never be able to answer any interview questions without stuttering.	Filtering
My trainer provided me with some feedback. He said I was very quick, but I needed to work on my resistance. I can't help but feel like I'm not good enough.	Filtering
It makes no difference if I have really good grades or if I improve; I should concentrate on why I did not achieve 100%.	Filtering
When someone compliments my programming abilities, I tend to believe that it is something that everyone can and should do.	Filtering
I quickly grow tired of people because I begin to focus solely on their flaws.	Filtering
I'm still obsessed with a mistake I made over ten years ago.	Filtering
I'm having a good day until I get home and see everything is a mess and people are screaming and I can't have piece.	Filtering
It is no longer worthwhile to have children because the world is so bad.	Filtering
I begin to realize that in no time, classes will resume and my vacation will be over.	Filtering
My mother expressed her wish that I were a better cook, so I'll never be good at it.	Filtering
if i receive feedback at work which says I'm a great team player, I have wonderful initiative, I have creative ideas and I could work on being more punctual, I focus solely on the fact that my boss said I should be more punctual and ignore all the other positive feedback.	Filtering
When someone praises my programming skills, I tend to believe that it is something that everyone can and should do.	Filtering
I quickly became bored with other people because I started focusing only on their shortcomings.	Filtering
It makes no difference if I have very good grades or if I improve; I have to concentrate on why I am not at 100%.	Filtering
There's no point in having children anymore because the world is so bad.	Filtering
I was obsessed with one question that I got wrong in the exam.	Filtering
My coach gave me some advice. He said that I was very fast, but I needed to work on my endurance. I couldn't help but feel that I wasn't good enough.	Filtering
I had a good day at work, but then the restaurant messed up my order and my whole day was ruined.	Filtering
I had a long standoff during one of my interview questions. I will never be able to answer interview questions without stuttering.	Filtering
I still remember a review at work maybe 10 years ago where I got feedback that I needed to manage my stress levels better. I'm sure my boss had half a dozen good things to say, but I don't remember any of them.	Filtering
I was having a good day until I got home and saw everything was a mess and people were screaming and I couldn't have piece.	Filtering
If I fail my final, my life will be over.	Catastrophizing
If I fail this test, I will never pass school, and I will be a total failure in life.	Catastrophizing
If I don’t recover quickly from this procedure, I will never get better, and I will be disabled my entire life.	Catastrophizing
If my partner leaves me, I will never find anyone else, and I will never be happy again.	Catastrophizing
Not getting hired following a job interview is expected to result in the inability to attain a job at all, ultimately resulting in poverty and homelessness.	Catastrophizing
Giving a class presentation is expected to cause embarrassment and failure, leading me to never show my face at school again.	Catastrophizing
Receiving a shot from the doctor is expected to be so overwhelming that it will result in fainting.	Catastrophizing
The end of a romantic relationship just means that I am unlovable.	Catastrophizing
I perceive a child’s skinned knee as suggesting that the playground is a far too dangerous place for the child to play.	Catastrophizing
I got a pimple and everyone thinks I am ugly.	Catastrophizing
After breaking my diet for a cookie, I believe I am a total failure at dieting and destined to be overweight forever.	Catastrophizing
After experiencing consistent headaches over the course of a week, I believe i am suffering from a brain tumor.	Catastrophizing
After my food poisoning incident, I believe all restaurants are dangerous and associated with terrible health outcomes.	Catastrophizing
I believe that riding on a boat is dangerous because it is sure to sink, causing all passengers to drown.	Catastrophizing
I am a new driver and I experienced a fender-bender and after that I decided to never drive again because I will always be a terrible driver.	Catastrophizing
I messed up a special dinner so I am a terrible cook that can’t do anything right.	Catastrophizing
I tripped over a rock while jogging and I realized that I am uncoordinated and that continuing running is likely to result in serious injury.	Catastrophizing
I watched a scary movie and I am convinced that it will come true.	Catastrophizing
After hearing about a shark attack on the other side of the world, I believe it’s unsafe to set foot in the ocean.	Catastrophizing
After seeing a documentary about a girl who was killed by her tinder date, I believe it is unsafe to meet new people online and that I should avoid it.	Catastrophizing
A girl was brutally killed in a theme park, so if I want to live a long life, I should avoid going there.	Catastrophizing
I'm going to avoid eating out after seeing a YouTube video about how filthy some restaurants are.	Catastrophizing
Everyone must think I'm disgusting because I'm so hairy.	Catastrophizing
My child's skinned knee suggests to me that the playground is far too dangerous for the child to play in.	Catastrophizing
The end of a relationship simply indicates that I am not good at them and should be alone instead.	Catastrophizing
I believe I will never be happy again because the person I loved the most died.	Catastrophizing
I was so embarrassed by my poor presentation that I avoided returning to class.	Catastrophizing
After watching a shark attack video, I'm afraid of the ocean and shouldn't go near it.	Catastrophizing
Humanity is a disgrace, and we should all be extinct, according to history.	Catastrophizing
No one is going to listen to me because of my stuttering.	Catastrophizing
If I fail in the final, my life will be over.	Catastrophizing
If I fail this exam, I will never graduate from school, and I will fail miserably in life.	Catastrophizing
I consider the child's chipped knee to indicate that the playground is too dangerous a place for the child to play.	Catastrophizing
After my food poisoning incident, I believe that all restaurants are dangerous and associated with poor health.	Catastrophizing
Receiving an injection from the doctor is expected to be so overwhelming that it will result in fainting.	Catastrophizing
I believed that getting on the boat was dangerous because it would definitely sink, causing all the passengers to drown.	Catastrophizing
If my child does bad things, it’s because I am a bad parent.	Polarized
If I couldn’t get that right, then I can’t be trusted with bigger projects. There’s no way I can ask for a raise now. They’re probably just keeping me around until they can hire someone else.	Polarized
I’m not cut out for this parenting thing. If I can’t even get my kids to school on time, what kind of dad am I?	Polarized
Who lets themselves live like this?, after all that money spent on therapy, I can’t even clean up after myself.	Polarized
I will never be fluent.	Polarized
I answered one question wrong, so I’m a failure.	Polarized
I didn’t get the promotion, so I might as well quit my job.	Polarized
I made a mistake because I’m a bad person.	Polarized
My sister is suicidal because I do not support her adequately, and as a result, I am a terrible person.	Polarized
I did not receive the highest possible grade, so I must withdraw from school.	Polarized
Because I did not learn quickly enough, I am a poor worker.	Polarized
I will never be fluent, no matter how hard I try.	Polarized
If my child acts recklessly, it is because I am a terrible parent.	Polarized
They're probably going to fire me because I made so many mistakes.	Polarized
I'm a complete loser with nothing to offer. Nobody wants to go out with me. Why bother looking for the right person when I'll never find it?	Polarized
I'll never be able to overcome my condition, and I let my anxiety ruin every situation.	Polarized
Even though I am aware that I have dyslexia, I still feel stupid whenever I make a mistake.	Polarized
There is no in-between in my life; it is either perfect or a disaster.	Polarized
If I can't eat clean all of the time, I give up and eat M&M's.	Polarized
I don't see the point of going to the gym if I can't go every day. I'll never achieve my fitness goals anyway.	Polarized
It's not worth doing something if I can't do it perfectly.	Polarized
I gave up my dream of becoming a singer because I see no point in pursuing it if I can't be the best.	Polarized
If I can't give this my undivided attention and time, it won't work.	Polarized
Why bother if I can't be perfect?	Polarized
What's the point of trying if nothing is perfect?	Polarized
You’re either successful or you’re worthless	Polarized
You’re smart or you’re stupid	Polarized
Something is right or it’s wrong.	Polarized
I’m good at something or I’m bad at something.	Polarized
I missed one gym session, so I’ll give up on exercise for the week.	Polarized
If I can't get it right, then I can't be trusted with bigger projects. There's no way I can ask for a raise now. They might just keep me until they can hire someone else.	Polarized
I'm not fit to take care of this child. If I can't even get my kids to school on time, what kind of father am I?	Polarized
Who would allow themselves to live like this, after all the money spent on therapy, I couldn't even clean myself up.	Polarized
I make mistakes because I'm a bad person.	Polarized
My younger sister committed suicide because I didn't support her adequately, and as a result, I became a bad person.	Polarized
I don't see the point in going to the gym if I can't go every day. I would never reach my fitness goals anyway.	Polarized
If I can't eat clean all the time, I give up and eat M&M's.	Polarized
I gave up my dream of becoming a singer, because I saw no point in pursuing it if I couldn't be the best.	Polarized
There's no point in doing something if I can't do it perfectly.	Polarized
I missed one gym session, so I will stop exercising for this week.	Polarized
You were expecting to get a promotion this year because of your hard work. You believe you worked harder than the rest of your colleagues but you didn’t get the promotion. You feel resentment towards your colleague because you believe you should have been rewarded for your hard work.	Heaven's Reward Fallacy
I’ve done everything right. I studied. I worked sincerely. I avoided alchol. I didn’t smoke. I woke up early. I exercised. I stayed faithful to my partner. I practised my skills to ace an interview. So why don’t I have a good career and a faithful partner?	Heaven's Reward Fallacy
I cooked elaborated meals for my family and did endless baking and sewing. I drove my children to all their afterschool activities but never did anything nice for myself.	Heaven's Reward Fallacy
The house was immaculate. She carried on for years, all the while waiting for some kind of special reward or appreciation. It never came, and the kids left home and her husband she suspected had affairs. She became increasingly hostile and bitter. The problem was that while she was doing the ‘right thing’ she was physically and emotionally bankrupting herself. She had become bitter and no one wanted to be around her.	Heaven's Reward Fallacy
John started at a new company and in the first few months it was great as he learned the ropes. He always wanted to help and always took on other people’s responsibilities. Soon managers and colleagues relied on him for everything. He couldn’t say no, but thought that people really depended on him and he would get all the favours back. He worked every Christmas for fifteen years, never said no because: “what goes around comes around.” When he had worked twenty years and it came time for his daughter’s wedding the boss thought it would be ok to send him to a conference that day instead, without asking him. When his boss insisted, he go because he hadn’t used the right annual leave form, he got so angry that he exploded with rage and lost his job. The interns in the office joked and laughed that it was always the quiet nice ones that were secretly crazy.	Heaven's Reward Fallacy
I’m only worth what I do for others, on my own they wouldn’t need/want/love me	Heaven's Reward Fallacy
I am a bad employee and a failure unless I always help everyone, others will notice, and I’ll be successful	Heaven's Reward Fallacy
It is only fair that hardworking people achieve success.	Heaven's Reward Fallacy
I spent every weekend in the library studying. I didn't get much sleep at night. I was expecting good grades because I had worked very hard for this. Now I'm resentful because of my poor academic performance.	Heaven's Reward Fallacy
The house was spotless. I kept going for years, hoping for some kind of special recognition or reward. It never arrived, the kids left, and I suspected my husband of having affairs. I became more hostile and bitter.	Heaven's Reward Fallacy
What did I do to deserve this, why is life so unfair? I never killed anyone, and I never harmed anyone. Why am I being mistreated if I am a good person?	Heaven's Reward Fallacy
Why can't I find a decent job after all of these years of studying and working hard for my degree? I expect to be paid more than the average because I have spent the last several years working hard.	Heaven's Reward Fallacy
I'll be a failure and a bad person unless I show people that I'm a good person and help everyone.	Heaven's Reward Fallacy
I don't socialize with my friends. In fact, I don't have many friends. I spent my entire day studying in my room. I dislike watching television and playing on my phone. I go to class and then straight home. I don't have any hobbies, but you know what? I don't regret it because I know that all of my hard work will be rewarded one day.	Heaven's Reward Fallacy
I always pay attention to her and offer her my candid opinion and advice. If I am a good friend, I should be able to attract good people. But I always end up with people like her, bad friends who don't care about you and are only concerned with themselves. Despite the fact that I gave her everything, she still acted for her own good.	Heaven's Reward Fallacy
I don't understand how people who don't even have a degree and spend their days watching TV and traveling can have a successful career.	Heaven's Reward Fallacy
I've always wondered why bad things happen to good people.	Heaven's Reward Fallacy
I come to the conclusion that my efforts are futile and give up on doing something good.	Heaven's Reward Fallacy
I believe I am giving it my all, so the universe should reciprocate.	Heaven's Reward Fallacy
When my hard work or sacrifice does not pay off, I become angry and frustrated.	Heaven's Reward Fallacy
As if someone is keeping score, I expect my sacrifice and self-denial to pay off.	Heaven's Reward Fallacy
I worked extremely hard and still did not receive a promotion. I'm not sure why life is so unfair and difficult.	Heaven's Reward Fallacy
It seems unfair that talented people die at such a young age.	Heaven's Reward Fallacy
I spend the entire day studying and working hard for my grades in order to make my parents proud, but I still get chastised by my mother. She believes that studying is simple and does not value my education. I am not a good daughter in her eyes.	Heaven's Reward Fallacy
Every day after work, I go grocery shopping and try to help out at home as much as I can, despite my exhaustion. When I get home, my wife is always sitting on the sofa doing nothing, and she still has the audacity to complain about me. Despite my best efforts, she does not recognize my worth and does not appreciate my efforts.	Heaven's Reward Fallacy
When I finally find someone with whom I have a special connection, they always leave my life. It's as if life is telling me that I don't deserve to be happy, which is so unjust. This is not something I deserve.	Heaven's Reward Fallacy
I always make certain that people notice all of my good deeds and that I appear to be a very good person. I believe that if they do not notice, I will not be considered a good person and will not be rewarded.	Heaven's Reward Fallacy
I've been working out at home every day, but I still haven't reached my body goals. I thought that if I worked hard enough, I would be able to achieve my goals, and it's so unfair.	Heaven's Reward Fallacy
I bought all of their albums, attended all of their concerts, and even became a member of their fan club. I was expecting them to notice me and respond to my emails. I'm their biggest fan; why can't I get a response? I'm so unjust.	Heaven's Reward Fallacy
If I work hard to hide my stuttering, no one will ever make fun of me.	Heaven's Reward Fallacy
You were hoping to get a promotion this year because of your hard work. You believe that you worked harder than your other colleagues, but you didn't get the promotion. You feel resentful towards your coworkers because you believe you should be rewarded for your hard work.	Heaven's Reward Fallacy
I have done everything right. I studied. I worked sincerely. I avoid alcohol. I don't smoke. I get up early. I exercise. I remain faithful to my partner. I practiced my skills to get through the interview. So why don't I have a good career and a loyal partner?	Heaven's Reward Fallacy
John started working at a new company and within the first few months, he was excited as he learned the ropes. He was always eager to help and always took on the responsibilities of others. Before long, managers and colleagues were relying on him for everything. She couldn't say no, but thought that people depended on her so much and she would get all the favors back. She worked every Christmas for fifteen years, never saying no because: "What goes around, comes around." When he had worked for twenty years and it was time for his daughter's wedding, his boss thought it was okay to send him to the conference on that day, without asking him. When her boss insisted she go because she didn't use the right annual leave form, she became so angry that she exploded with rage and lost her job. The interns in the office joked and laughed that it's always the quiet nice person who is secretly crazy.	Heaven's Reward Fallacy
Every day after work, I went grocery shopping and tried to help out at home as much as I could, even though I was exhausted. When I got home, my wife always sat on the sofa doing nothing, and she still dared to complain about me. Despite my best efforts, she doesn't recognize my value and doesn't appreciate my efforts.	Heaven's Reward Fallacy
It seems unfair that talented people die at such a young age.	Heaven's Reward Fallacy
I will be a failure and a bad person unless I show people that I am a good person and help everyone.	Heaven's Reward Fallacy
I didn't socialize with my friends. In fact, I didn't have many friends. I spend my entire day studying in my room. I didn't like watching television and playing with my cell phone. I go to class and then go straight home. I had no hobbies, but you know what? I don't regret it because I know that all my hard work will be rewarded one day.	Heaven's Reward Fallacy
What have I done to deserve this, why is life so unfair? I have never killed anyone, and I have never hurt anyone. Why am I being persecuted if I'm a good person?	Heaven's Reward Fallacy
Why can't I get a decent job after years of studying and working hard for my degree? I expect to be paid more than average as I have spent the last few years working hard.	Heaven's Reward Fallacy
I spent every weekend in the library studying. I didn't sleep much at night. I expected good grades because I had worked so hard for this. Now I am upset because of my poor academic performance.	Heaven's Reward Fallacy
I believe I gave my all, so the universe should reciprocate.	Heaven's Reward Fallacy
It is only fair that people who work hard achieve success.	Heaven's Reward Fallacy
I concluded that my efforts were in vain and gave up on doing anything good.	Heaven's Reward Fallacy
I've always wondered why bad things happen to good people.	Heaven's Reward Fallacy
Sharon expects flowers or gifts every Friday from Tom because she saw her mother get this from her father. When she doesn’t get them, she feels anxious, hurt, rejected and angry. Tom has no idea, and continually walks every Friday night into firestorms of accusations of being uncaring and unloving.	Fallacy Of Fairness
If he loved me, he’d do the dishes	Fallacy Of Fairness
if he cared at all, he’d come home right after work.	Fallacy Of Fairness
Many of us today grew up being told that we could be whatever we wanted to be. Now when we don’t get praise in work or even if we get reprimanded this can go against that we would consider “fair”. It’s not fair for us to be criticised. We were supposed to be the success.	Fallacy Of Fairness
if they valued my work here, they’d get me a nicer desk.	Fallacy Of Fairness
Sarah got a promotion and I didn’t, that’s not fair!	Fallacy Of Fairness
Bad things happen to bad people so why I'm struggling?	Fallacy Of Fairness
Your doctor's office has a strict late policy, and even if you arrive late, you expect to be seen because you believe your situation is unique and it would be unfair for them not to acknowledge your extraordinary circumstances.	Fallacy Of Fairness
I believe I should be given a raise at work because everyone else has, and it would be fair.	Fallacy Of Fairness
They should at the very least wait for me for at least 5 minutes. Even though I was late, they should understand that it was not my fault; the subway was slow. It's unfair that I missed my train by only 5 minutes.	Fallacy Of Fairness
I don't understand why the teacher made me go to the final despite knowing how hard I worked for it and how much I struggle with the subject. He utterly failed me with a 49%.	Fallacy Of Fairness
Because of covid, I assumed that teachers would be more reliant on exams. The overall quality of online classes was poor, and they should recognize that not everyone has a favorable environment at home to concentrate and study. I still can't believe the exam was so difficult.	Fallacy Of Fairness
I believe it would be most equal and fair for me to be promoted because I have been with the company the longest and do a good enough job in comparison to other applicants.	Fallacy Of Fairness
